{
  "id": "d4444444-4444-4444-8444-444444444444",
  "organization_id": "b2222222-2222-4222-8222-222222222222",
  "name": "Attested secure runtime authentication",
  "trust_profile_id": "e5555555-5555-4555-8555-555555555555",
  "required_credential_types": [
    "MachineManufacturerCertification",
    "DeploymentAssignment"
  ],
  "allowed_machine_types": [
    "SECURE_DOCUMENT_PRINTER",
    "DOCUMENT_PERSONALIZATION_SYSTEM",
    "SECURE_PROCESSING_RUNTIME"
  ],
  "machine_binding": {
    "binding_methods": ["MACHINE_KEY"],
    "proof_profiles": ["SIGNED_CHALLENGE"],
    "proof_freshness": {
      "challenge_required": true,
      "audience_binding_required": true,
      "replay_detection_required": true,
      "max_proof_age_seconds": 60
    }
  },
  "attestation_requirement": {
    "required": true,
    "accepted_formats": ["EAT"],
    "verifier_trust_profile_id": "f6666666-6666-4666-8666-666666666666",
    "max_age_seconds": 300,
    "challenge_required": true,
    "identity_key_binding_required": true
  },
  "authorization_policy_set_id": "07777777-7777-4777-8777-777777777777",
  "status": "ACTIVE",
  "created_at": "2026-07-28T00:00:00Z"
}
